,name,colors,manaValue,manaCost,power,toughness,loyalty,text,rarity,keywords,supertypes,types,subtypes
0,"Ugin, the Spirit Dragon",C,8.0,{8},,,7.0,"[+2]: Ugin, the Spirit Dragon deals 3 damage to any target.
[−X]: Exile each permanent with mana value X or less that's one or more colors.
[−10]: You gain 7 life, draw seven cards, then put up to seven permanent cards from your hand onto the battlefield.",mythic,,Legendary,Planeswalker,Ugin
1,Alpine Watchdog,W,2.0,{1}{W},2.0,2.0,,Vigilance (Attacking doesn't cause this creature to tap.),common,Vigilance,,Creature,Dog
2,Angelic Ascension,W,2.0,{1}{W},,,,Exile target creature or planeswalker. Its controller creates a 4/4 white Angel creature token with flying.,uncommon,,,Instant,
3,Anointed Chorister,W,1.0,{W},1.0,1.0,,"Lifelink (Damage dealt by this creature also causes you to gain that much life.)
{4}{W}: Anointed Chorister gets +3/+3 until end of turn.",common,Lifelink,,Creature,"Human, Cleric"
4,Aven Gagglemaster,W,5.0,{3}{W}{W},4.0,3.0,,"Flying
When Aven Gagglemaster enters the battlefield, you gain 2 life for each creature you control with flying.",uncommon,Flying,,Creature,"Bird, Warrior"
5,Baneslayer Angel,W,5.0,{3}{W}{W},5.0,5.0,,"Flying, first strike, lifelink, protection from Demons and from Dragons",mythic,"First strike, Flying, Lifelink, Protection",,Creature,Angel
6,Basri Ket,W,3.0,{1}{W}{W},,,3.0,"[+1]: Put a +1/+1 counter on up to one target creature. It gains indestructible until end of turn.
[−2]: Whenever one or more nontoken creatures attack this turn, create that many 1/1 white Soldier creature tokens that are tapped and attacking.
[−6]: You get an emblem with ""At the beginning of combat on your turn, create a 1/1 white Soldier creature token, then put a +1/+1 counter on each creature you control.""",mythic,,Legendary,Planeswalker,Basri
7,Basri's Acolyte,W,4.0,{2}{W}{W},2.0,3.0,,"Lifelink (Damage dealt by this creature also causes you to gain that much life.)
When Basri's Acolyte enters the battlefield, put a +1/+1 counter on each of up to two other target creatures you control.",common,Lifelink,,Creature,"Cat, Cleric"
8,Basri's Lieutenant,W,4.0,{3}{W},3.0,4.0,,"Vigilance, protection from multicolored
When Basri's Lieutenant enters the battlefield, put a +1/+1 counter on target creature you control.
Whenever Basri's Lieutenant or another creature you control dies, if it had a +1/+1 counter on it, create a 2/2 white Knight creature token with vigilance.",rare,"Protection, Vigilance",,Creature,"Human, Knight"
9,Basri's Solidarity,W,2.0,{1}{W},,,,Put a +1/+1 counter on each creature you control.,uncommon,,,Sorcery,
10,Celestial Enforcer,W,3.0,{2}{W},2.0,3.0,,"{1}{W}, {T}: Tap target creature. Activate only if you control a creature with flying.",common,,,Creature,"Human, Cleric"
11,Concordia Pegasus,W,2.0,{1}{W},1.0,3.0,,Flying,common,Flying,,Creature,Pegasus
12,Containment Priest,W,2.0,{1}{W},2.0,2.0,,"Flash
If a nontoken creature would enter the battlefield and it wasn't cast, exile it instead.",rare,Flash,,Creature,"Human, Cleric"
13,Daybreak Charger,W,2.0,{1}{W},3.0,1.0,,"When Daybreak Charger enters the battlefield, target creature gets +2/+0 until end of turn.",common,,,Creature,Unicorn
14,Defiant Strike,W,1.0,{W},,,,"Target creature gets +1/+0 until end of turn.
Draw a card.",common,,,Instant,
15,Dub,W,3.0,{2}{W},,,,"Enchant creature
Enchanted creature gets +2/+2, has first strike, and is a Knight in addition to its other types. (It deals combat damage before creatures without first strike.)",common,Enchant,,Enchantment,Aura
16,Faith's Fetters,W,4.0,{3}{W},,,,"Enchant permanent
When Faith's Fetters enters the battlefield, you gain 4 life.
Enchanted permanent can't attack or block, and its activated abilities can't be activated unless they're mana abilities.",uncommon,Enchant,,Enchantment,Aura
17,Falconer Adept,W,4.0,{3}{W},2.0,3.0,,"Whenever Falconer Adept attacks, create a 1/1 white Bird creature token with flying that's tapped and attacking.",uncommon,,,Creature,"Human, Soldier"
18,Feat of Resistance,W,2.0,{1}{W},,,,"Put a +1/+1 counter on target creature you control. It gains protection from the color of your choice until end of turn. (It can't be blocked, targeted, dealt damage, enchanted, or equipped by anything of that color.)",common,,,Instant,
19,Gale Swooper,W,4.0,{3}{W},3.0,2.0,,"Flying
When Gale Swooper enters the battlefield, target creature gains flying until end of turn.",common,Flying,,Creature,Griffin
20,Glorious Anthem,W,3.0,{1}{W}{W},,,,Creatures you control get +1/+1.,rare,,,Enchantment,
21,Griffin Aerie,W,2.0,{1}{W},,,,"At the beginning of your end step, if you gained 3 or more life this turn, create a 2/2 white Griffin creature token with flying.",uncommon,,,Enchantment,
22,Idol of Endurance,W,3.0,{2}{W},,,,"When Idol of Endurance enters the battlefield, exile all creature cards with mana value 3 or less from your graveyard until Idol of Endurance leaves the battlefield.
{1}{W}, {T}: Until end of turn, you may cast a creature spell from among cards exiled with Idol of Endurance without paying its mana cost.",rare,,,Artifact,
23,Legion's Judgment,W,3.0,{2}{W},,,,Destroy target creature with power 4 or greater.,common,,,Sorcery,
24,Light of Promise,W,3.0,{2}{W},,,,"Enchant creature
Enchanted creature has ""Whenever you gain life, put that many +1/+1 counters on this creature.""",uncommon,Enchant,,Enchantment,Aura
25,Makeshift Battalion,W,3.0,{2}{W},3.0,2.0,,"Whenever Makeshift Battalion and at least two other creatures attack, put a +1/+1 counter on Makeshift Battalion.",common,,,Creature,"Human, Soldier"
26,"Mangara, the Diplomat",W,4.0,{3}{W},2.0,4.0,,"Lifelink
Whenever an opponent attacks with creatures, if two or more of those creatures are attacking you and/or planeswalkers you control, draw a card.
Whenever an opponent casts their second spell each turn, draw a card.",mythic,Lifelink,Legendary,Creature,"Human, Cleric"
27,Nine Lives,W,3.0,{1}{W}{W},,,,"Hexproof
If a source would deal damage to you, prevent that damage and put an incarnation counter on Nine Lives.
When there are nine or more incarnation counters on Nine Lives, exile it.
When Nine Lives leaves the battlefield, you lose the game.",rare,Hexproof,,Enchantment,
28,Pack Leader,W,2.0,{1}{W},2.0,2.0,,"Other Dogs you control get +1/+1.
Whenever Pack Leader attacks, prevent all combat damage that would be dealt this turn to Dogs you control.",rare,,,Creature,Dog
29,Rambunctious Mutt,W,5.0,{3}{W}{W},3.0,4.0,,"When Rambunctious Mutt enters the battlefield, destroy target artifact or enchantment an opponent controls.",common,,,Creature,Dog
30,Revitalize,W,2.0,{1}{W},,,,"You gain 3 life.
Draw a card.",common,,,Instant,
31,Runed Halo,W,2.0,{W}{W},,,,"As Runed Halo enters the battlefield, choose a card name.
You have protection from the chosen card name. (You can't be targeted, dealt damage, or enchanted by anything with that name.)",rare,,,Enchantment,
32,Sanctum of Tranquil Light,W,1.0,{W},,,,{5}{W}: Tap target creature. This ability costs {1} less to activate for each Shrine you control.,uncommon,,Legendary,Enchantment,Shrine
33,Seasoned Hallowblade,W,2.0,{1}{W},3.0,1.0,,"Discard a card: Tap Seasoned Hallowblade. It gains indestructible until end of turn. (Damage and effects that say ""destroy"" don't destroy it.)",uncommon,,,Creature,"Human, Warrior"
34,Secure the Scene,W,5.0,{4}{W},,,,Exile target nonland permanent. Its controller creates a 1/1 white Soldier creature token.,common,,,Sorcery,
35,Selfless Savior,W,1.0,{W},1.0,1.0,,"Sacrifice Selfless Savior: Another target creature you control gains indestructible until end of turn. (Damage and effects that say ""destroy"" don't destroy it.)",uncommon,,,Creature,Dog
36,Siege Striker,W,3.0,{2}{W},1.0,1.0,,"Double strike (This creature deals both first-strike and regular combat damage.)
Whenever Siege Striker attacks, you may tap any number of untapped creatures you control. Siege Striker gets +1/+1 until end of turn for each creature tapped this way.",uncommon,Double strike,,Creature,"Human, Soldier"
37,Speaker of the Heavens,W,1.0,{W},1.0,1.0,,"Vigilance, lifelink
{T}: Create a 4/4 white Angel creature token with flying. Activate only if you have at least 7 life more than your starting life total and only as a sorcery.",rare,"Lifelink, Vigilance",,Creature,"Human, Cleric"
38,Staunch Shieldmate,W,1.0,{W},1.0,3.0,,,common,,,Creature,"Dwarf, Soldier"
39,Swift Response,W,2.0,{1}{W},,,,Destroy target tapped creature.,common,,,Instant,
40,Tempered Veteran,W,2.0,{1}{W},1.0,2.0,,"{W}, {T}: Put a +1/+1 counter on target creature with a +1/+1 counter on it.
{4}{W}{W}, {T}: Put a +1/+1 counter on target creature.",uncommon,,,Creature,"Human, Knight"
41,Valorous Steed,W,5.0,{4}{W},3.0,3.0,,"Vigilance (Attacking doesn't cause this creature to tap.)
When Valorous Steed enters the battlefield, create a 2/2 white Knight creature token with vigilance.",common,Vigilance,,Creature,Unicorn
42,Vryn Wingmare,W,3.0,{2}{W},2.0,1.0,,"Flying
Noncreature spells cost {1} more to cast.",uncommon,Flying,,Creature,Pegasus
43,Warded Battlements,W,3.0,{2}{W},0.0,3.0,,"Defender (This creature can't attack.)
Attacking creatures you control get +1/+0.",common,Defender,,Creature,Wall
44,"Barrin, Tolarian Archmage",U,3.0,{1}{U}{U},2.0,2.0,,"When Barrin, Tolarian Archmage enters the battlefield, return up to one other target creature or planeswalker to its owner's hand.
At the beginning of your end step, if a permanent was put into your hand from the battlefield this turn, draw a card.",rare,,Legendary,Creature,"Human, Wizard"
45,Cancel,U,3.0,{1}{U}{U},,,,Counter target spell.,common,,,Instant,
46,Capture Sphere,U,4.0,{3}{U},,,,"Flash (You may cast this spell any time you could cast an instant.)
Enchant creature
When Capture Sphere enters the battlefield, tap enchanted creature.
Enchanted creature doesn't untap during its controller's untap step.",common,"Enchant, Flash",,Enchantment,Aura
47,Discontinuity,U,6.0,{3}{U}{U}{U},,,,"As long as it's your turn, this spell costs {2}{U}{U} less to cast.
End the turn. (Exile all spells and abilities from the stack, including this card. The player whose turn it is discards down to their maximum hand size. Damage wears off, and ""this turn"" and ""until end of turn"" effects end.)",mythic,,,Instant,
48,Enthralling Hold,U,5.0,{3}{U}{U},,,,"Enchant creature
You can't choose an untapped creature as this spell's target as you cast it.
You control enchanted creature.",uncommon,Enchant,,Enchantment,Aura
49,Frantic Inventory,U,2.0,{1}{U},,,,"Draw a card, then draw cards equal to the number of cards named Frantic Inventory in your graveyard.",common,,,Instant,
50,Frost Breath,U,3.0,{2}{U},,,,Tap up to two target creatures. Those creatures don't untap during their controller's next untap step.,common,,,Instant,
51,Ghostly Pilferer,U,2.0,{1}{U},2.0,1.0,,"Whenever Ghostly Pilferer becomes untapped, you may pay {2}. If you do, draw a card.
Whenever an opponent casts a spell from anywhere other than their hand, draw a card.
Discard a card: Ghostly Pilferer can't be blocked this turn.",rare,,,Creature,"Spirit, Rogue"
52,Jeskai Elder,U,2.0,{1}{U},1.0,2.0,,"Prowess (Whenever you cast a noncreature spell, this creature gets +1/+1 until end of turn.)
Whenever Jeskai Elder deals combat damage to a player, you may draw a card. If you do, discard a card.",uncommon,Prowess,,Creature,"Human, Monk"
53,Keen Glidemaster,U,2.0,{1}{U},2.0,1.0,,{2}{U}: Target creature gains flying until end of turn.,common,,,Creature,"Human, Soldier"
54,Library Larcenist,U,3.0,{2}{U},1.0,2.0,,"Whenever Library Larcenist attacks, draw a card.",common,,,Creature,"Merfolk, Rogue"
55,Lofty Denial,U,2.0,{1}{U},,,,"Counter target spell unless its controller pays {1}. If you control a creature with flying, counter that spell unless its controller pays {4} instead.",common,,,Instant,
56,Miscast,U,1.0,{U},,,,Counter target instant or sorcery spell unless its controller pays {3}.,uncommon,,,Instant,
57,Mistral Singer,U,3.0,{2}{U},2.0,2.0,,"Flying
Prowess (Whenever you cast a noncreature spell, this creature gets +1/+1 until end of turn.)",common,"Flying, Prowess",,Creature,Siren
58,Opt,U,1.0,{U},,,,"Scry 1.
Draw a card.",common,Scry,,Instant,
59,Pursued Whale,U,7.0,{5}{U}{U},8.0,8.0,,"When Pursued Whale enters the battlefield, each opponent creates a 1/1 red Pirate creature token with ""This creature can't block"" and ""Creatures you control attack each combat if able.""
Spells your opponents cast that target Pursued Whale cost {3} more to cast.",rare,,,Creature,Whale
60,Rain of Revelation,U,4.0,{3}{U},,,,"Draw three cards, then discard a card.",uncommon,,,Instant,
61,Read the Tides,U,6.0,{5}{U},,,,"Choose one —
• Draw three cards.
• Return up to two target creatures to their owners' hands.",common,,,Sorcery,
62,Rewind,U,4.0,{2}{U}{U},,,,Counter target spell. Untap up to four lands.,uncommon,,,Instant,
63,Riddleform,U,2.0,{1}{U},,,,"Whenever you cast a noncreature spell, you may have Riddleform become a 3/3 Sphinx creature with flying in addition to its other types until end of turn.
{2}{U}: Scry 1. (Look at the top card of your library. You may put that card on the bottom of your library.)",uncommon,Scry,,Enchantment,
64,Roaming Ghostlight,U,5.0,{3}{U}{U},3.0,2.0,,"Flying
When Roaming Ghostlight enters the battlefield, return up to one target non-Spirit creature to its owner's hand.",common,Flying,,Creature,Spirit
65,Rookie Mistake,U,1.0,{U},,,,"Until end of turn, target creature gets +0/+2 and another target creature gets -2/-0.",common,,,Instant,
66,Rousing Read,U,3.0,{2}{U},,,,"Enchant creature
When Rousing Read enters the battlefield, draw two cards, then discard a card.
Enchanted creature gets +1/+1 and has flying.",common,Enchant,,Enchantment,Aura
67,Sanctum of Calm Waters,U,4.0,{3}{U},,,,"At the beginning of your precombat main phase, you may draw X cards, where X is the number of Shrines you control. If you do, discard a card.",uncommon,,Legendary,Enchantment,Shrine
68,See the Truth,U,2.0,{1}{U},,,,"Look at the top three cards of your library. Put one of those cards into your hand and the rest on the bottom of your library in any order. If this spell was cast from anywhere other than your hand, put each of those cards into your hand instead.",rare,,,Sorcery,
69,Shacklegeist,U,2.0,{1}{U},2.0,2.0,,"Flying
Shacklegeist can block only creatures with flying.
Tap two untapped Spirits you control: Tap target creature you don't control.",rare,Flying,,Creature,Spirit
70,Shipwreck Dowser,U,5.0,{3}{U}{U},3.0,3.0,,"Prowess (Whenever you cast a noncreature spell, this creature gets +1/+1 until end of turn.)
When Shipwreck Dowser enters the battlefield, return target instant or sorcery card from your graveyard to your hand.",uncommon,Prowess,,Creature,"Merfolk, Wizard"
71,Spined Megalodon,U,7.0,{5}{U}{U},5.0,7.0,,"Hexproof (This creature can't be the target of spells or abilities your opponents control.)
Whenever Spined Megalodon attacks, scry 1. (Look at the top card of your library. You may put that card on the bottom of your library.)",common,"Hexproof, Scry",,Creature,Shark
72,Stormwing Entity,U,5.0,{3}{U}{U},3.0,3.0,,"This spell costs {2}{U} less to cast if you've cast an instant or sorcery spell this turn.
Flying
Prowess (Whenever you cast a noncreature spell, this creature gets +1/+1 until end of turn.)
When Stormwing Entity enters the battlefield, scry 2.",rare,"Flying, Prowess, Scry",,Creature,Elemental
73,Sublime Epiphany,U,6.0,{4}{U}{U},,,,"Choose one or more —
• Counter target spell.
• Counter target activated or triggered ability.
• Return target nonland permanent to its owner's hand.
• Create a token that's a copy of target creature you control.
• Target player draws a card.",rare,,,Instant,
74,"Teferi, Master of Time",U,4.0,{2}{U}{U},,,3.0,"You may activate loyalty abilities of Teferi, Master of Time on any player's turn any time you could cast an instant.
[+1]: Draw a card, then discard a card.
[−3]: Target creature you don't control phases out. (Treat it and anything attached to it as though they don't exist until its controller's next turn.)
[−10]: Take two extra turns after this one.",mythic,,Legendary,Planeswalker,Teferi
75,Teferi's Ageless Insight,U,4.0,{2}{U}{U},,,,"If you would draw a card except the first one you draw in each of your draw steps, draw two cards instead.",rare,,Legendary,Enchantment,
76,Teferi's Protege,U,3.0,{2}{U},2.0,3.0,,"{1}{U}, {T}: Draw a card, then discard a card.",common,,,Creature,"Human, Wizard"
77,Teferi's Tutelage,U,3.0,{2}{U},,,,"When Teferi's Tutelage enters the battlefield, draw a card, then discard a card.
Whenever you draw a card, target opponent mills two cards. (They put the top two cards of their library into their graveyard.)",uncommon,Mill,,Enchantment,
78,Tide Skimmer,U,4.0,{3}{U},2.0,3.0,,"Flying
Whenever you attack with two or more creatures with flying, draw a card.",uncommon,Flying,,Creature,Drake
79,Tolarian Kraken,U,6.0,{4}{U}{U},4.0,6.0,,"Whenever you draw a card, you may pay {1}. When you do, you may tap or untap target creature.",uncommon,,,Creature,Kraken
80,Tome Anima,U,4.0,{3}{U},3.0,3.0,,Tome Anima can't be blocked as long as you've drawn two or more cards this turn.,common,,,Creature,Spirit
81,Unsubstantiate,U,2.0,{1}{U},,,,Return target spell or creature to its owner's hand.,uncommon,,,Instant,
82,Vodalian Arcanist,U,2.0,{1}{U},1.0,3.0,,{T}: Add {C}. Spend this mana only to cast an instant or sorcery spell.,common,,,Creature,"Merfolk, Wizard"
83,Waker of Waves,U,7.0,{5}{U}{U},7.0,7.0,,"Creatures your opponents control get -1/-0.
{1}{U}, Discard Waker of Waves: Look at the top two cards of your library. Put one of them into your hand and the other into your graveyard.",uncommon,,,Creature,Whale
84,Wall of Runes,U,1.0,{U},0.0,4.0,,"Defender (This creature can't attack.)
When Wall of Runes enters the battlefield, scry 1. (Look at the top card of your library. You may put that card on the bottom of your library.)",common,"Defender, Scry",,Creature,Wall
85,Wishcoin Crab,U,4.0,{3}{U},2.0,5.0,,,common,,,Creature,Crab
86,Alchemist's Gift,B,1.0,{B},,,,Target creature gets +1/+1 and gains your choice of deathtouch or lifelink until end of turn. (Any amount of damage a creature with deathtouch deals to a creature is enough to destroy it. Damage dealt by a creature with lifelink also causes its controller to gain that much life.),common,,,Instant,
87,Archfiend's Vessel,B,1.0,{B},1.0,1.0,,"Lifelink (Damage dealt by this creature also causes you to gain that much life.)
When Archfiend's Vessel enters the battlefield, if it entered from your graveyard or you cast it from your graveyard, exile it. If you do, create a 5/5 black Demon creature token with flying.",uncommon,Lifelink,,Creature,"Human, Cleric"
88,Bad Deal,B,6.0,{4}{B}{B},,,,You draw two cards and each opponent discards two cards. Each player loses 2 life.,uncommon,,,Sorcery,
89,Blood Glutton,B,5.0,{4}{B},4.0,3.0,,Lifelink (Damage dealt by this creature also causes you to gain that much life.),common,Lifelink,,Creature,Vampire
90,Caged Zombie,B,3.0,{2}{B},2.0,3.0,,"{1}{B}, {T}: Each opponent loses 2 life. Activate only if a creature died this turn.",common,,,Creature,Zombie
91,Carrion Grub,B,4.0,{3}{B},0.0,5.0,,"Carrion Grub gets +X/+0, where X is the greatest power among creature cards in your graveyard.
When Carrion Grub enters the battlefield, mill four cards. (Put the top four cards of your library into your graveyard.)",uncommon,Mill,,Creature,Insect
92,Crypt Lurker,B,4.0,{3}{B},3.0,4.0,,"When Crypt Lurker enters the battlefield, you may sacrifice a creature or discard a creature card. If you do, draw a card.",common,,,Creature,Horror
93,Deathbloom Thallid,B,3.0,{2}{B},3.0,2.0,,"When Deathbloom Thallid dies, create a 1/1 green Saproling creature token.",common,,,Creature,Fungus
94,Demonic Embrace,B,3.0,{1}{B}{B},,,,"Enchant creature
Enchanted creature gets +3/+1, has flying, and is a Demon in addition to its other types.
You may cast Demonic Embrace from your graveyard by paying 3 life and discarding a card in addition to paying its other costs.",rare,Enchant,,Enchantment,Aura
95,Duress,B,1.0,{B},,,,"Target opponent reveals their hand. You choose a noncreature, nonland card from it. That player discards that card.",common,,,Sorcery,
96,Eliminate,B,2.0,{1}{B},,,,Destroy target creature or planeswalker with mana value 3 or less.,uncommon,,,Instant,
97,Fetid Imp,B,2.0,{1}{B},1.0,2.0,,"Flying
{B}: Fetid Imp gains deathtouch until end of turn. (Any amount of damage it deals to a creature is enough to destroy it.)",common,Flying,,Creature,Imp
98,Finishing Blow,B,5.0,{4}{B},,,,Destroy target creature or planeswalker.,common,,,Instant,
99,Gloom Sower,B,7.0,{5}{B}{B},8.0,6.0,,"Whenever Gloom Sower becomes blocked by a creature, that creature's controller loses 2 life and you gain 2 life.",common,,,Creature,Horror
100,Goremand,B,6.0,{4}{B}{B},5.0,5.0,,"As an additional cost to cast this spell, sacrifice a creature.
Flying
Trample (This creature can deal excess combat damage to the player or planeswalker it's attacking.)
When Goremand enters the battlefield, each opponent sacrifices a creature.",uncommon,"Flying, Trample",,Creature,Demon
101,Grasp of Darkness,B,2.0,{B}{B},,,,Target creature gets -4/-4 until end of turn.,common,,,Instant,
102,Grim Tutor,B,3.0,{1}{B}{B},,,,"Search your library for a card, put that card into your hand, then shuffle. You lose 3 life.",mythic,,,Sorcery,
103,Hooded Blightfang,B,3.0,{2}{B},1.0,4.0,,"Deathtouch
Whenever a creature you control with deathtouch attacks, each opponent loses 1 life and you gain 1 life.
Whenever a creature you control with deathtouch deals damage to a planeswalker, destroy that planeswalker.",rare,Deathtouch,,Creature,Snake
104,Infernal Scarring,B,2.0,{1}{B},,,,"Enchant creature
Enchanted creature gets +2/+0 and has ""When this creature dies, draw a card.""",common,Enchant,,Enchantment,Aura
105,"Kaervek, the Spiteful",B,4.0,{2}{B}{B},3.0,2.0,,Other creatures get -1/-1.,rare,,Legendary,Creature,"Human, Warlock"
106,Kitesail Freebooter,B,2.0,{1}{B},1.0,2.0,,"Flying
When Kitesail Freebooter enters the battlefield, target opponent reveals their hand. You choose a noncreature, nonland card from it. Exile that card until Kitesail Freebooter leaves the battlefield.",uncommon,Flying,,Creature,"Human, Pirate"
107,"Liliana, Waker of the Dead",B,4.0,{2}{B}{B},,,4.0,"[+1]: Each player discards a card. Each opponent who can't loses 3 life.
[−3]: Target creature gets -X/-X until end of turn, where X is the number of cards in your graveyard.
[−7]: You get an emblem with ""At the beginning of combat on your turn, put target creature card from a graveyard onto the battlefield under your control. It gains haste.""",mythic,,Legendary,Planeswalker,Liliana
108,Liliana's Devotee,B,3.0,{2}{B},2.0,3.0,,"Zombies you control get +1/+0.
At the beginning of your end step, if a creature died this turn, you may pay {1}{B}. If you do, create a 2/2 black Zombie creature token.",uncommon,,,Creature,"Human, Warlock"
109,Liliana's Standard Bearer,B,3.0,{2}{B},3.0,1.0,,"Flash
When Liliana's Standard Bearer enters the battlefield, draw X cards, where X is the number of creatures that died under your control this turn.",rare,Flash,,Creature,"Zombie, Knight"
110,Liliana's Steward,B,1.0,{B},1.0,2.0,,"{T}, Sacrifice Liliana's Steward: Target opponent discards a card. Activate only as a sorcery.",common,,,Creature,Zombie
111,Malefic Scythe,B,2.0,{1}{B},,,,"Malefic Scythe enters the battlefield with a soul counter on it.
Equipped creature gets +1/+1 for each soul counter on Malefic Scythe.
Whenever equipped creature dies, put a soul counter on Malefic Scythe.
Equip {1} ({1}: Attach to target creature you control. Equip only as a sorcery.)",uncommon,Equip,,Artifact,Equipment
112,Masked Blackguard,B,2.0,{1}{B},2.0,1.0,,"Flash (You may cast this spell any time you could cast an instant.)
{2}{B}: Masked Blackguard gets +1/+1 until end of turn.",common,Flash,,Creature,"Human, Rogue"
113,Massacre Wurm,B,6.0,{3}{B}{B}{B},6.0,5.0,,"When Massacre Wurm enters the battlefield, creatures your opponents control get -2/-2 until end of turn.
Whenever a creature an opponent controls dies, that player loses 2 life.",mythic,,,Creature,"Phyrexian, Wurm"
114,Mind Rot,B,3.0,{2}{B},,,,Target player discards two cards.,common,,,Sorcery,
115,Necromentia,B,3.0,{1}{B}{B},,,,"Choose a card name other than a basic land card name. Search target opponent's graveyard, hand, and library for any number of cards with that name and exile them. That player shuffles, then creates a 2/2 black Zombie creature token for each card exiled from their hand this way.",rare,,,Sorcery,
116,Peer into the Abyss,B,7.0,{4}{B}{B}{B},,,,Target player draws cards equal to half the number of cards in their library and loses half their life. Round up each time.,rare,,,Sorcery,
117,Pestilent Haze,B,3.0,{1}{B}{B},,,,"Choose one —
• All creatures get -2/-2 until end of turn.
• Remove two loyalty counters from each planeswalker.",uncommon,,,Sorcery,
118,Rise Again,B,5.0,{4}{B},,,,Return target creature card from your graveyard to the battlefield.,common,,,Sorcery,
119,Sanctum of Stone Fangs,B,2.0,{1}{B},,,,"At the beginning of your precombat main phase, each opponent loses X life and you gain X life, where X is the number of Shrines you control.",uncommon,,Legendary,Enchantment,Shrine
120,Sanguine Indulgence,B,4.0,{3}{B},,,,"This spell costs {3} less to cast if you've gained 3 or more life this turn.
Return up to two target creature cards from your graveyard to your hand.",common,,,Sorcery,
121,Silversmote Ghoul,B,3.0,{2}{B},3.0,1.0,,"At the beginning of your end step, if you gained 3 or more life this turn, return Silversmote Ghoul from your graveyard to the battlefield tapped.
{1}{B}, Sacrifice Silversmote Ghoul: Draw a card.",uncommon,,,Creature,"Zombie, Vampire"
