,name,colors,manaValue,manaCost,power,toughness,loyalty,text,rarity,keywords,supertypes,types,subtypes
240,Tormod's Crypt,C,0.0,{0},,,,"{T}, Sacrifice Tormod's Crypt: Exile target player's graveyard.",uncommon,,,Artifact,
241,Animal Sanctuary,L,0.0,,,,,"{T}: Add {C}.
{2}, {T}: Put a +1/+1 counter on target Bird, Cat, Dog, Goat, Ox, or Snake.",rare,,,Land,
242,Bloodfell Caves,L,0.0,,,,,"Bloodfell Caves enters the battlefield tapped.
When Bloodfell Caves enters the battlefield, you gain 1 life.
{T}: Add {B} or {R}.",common,,,Land,
243,Blossoming Sands,L,0.0,,,,,"Blossoming Sands enters the battlefield tapped.
When Blossoming Sands enters the battlefield, you gain 1 life.
{T}: Add {G} or {W}.",common,,,Land,
244,Dismal Backwater,L,0.0,,,,,"Dismal Backwater enters the battlefield tapped.
When Dismal Backwater enters the battlefield, you gain 1 life.
{T}: Add {U} or {B}.",common,,,Land,
245,Fabled Passage,L,0.0,,,,,"{T}, Sacrifice Fabled Passage: Search your library for a basic land card, put it onto the battlefield tapped, then shuffle. Then if you control four or more lands, untap that land.",rare,,,Land,
246,Jungle Hollow,L,0.0,,,,,"Jungle Hollow enters the battlefield tapped.
When Jungle Hollow enters the battlefield, you gain 1 life.
{T}: Add {B} or {G}.",common,,,Land,
247,Radiant Fountain,L,0.0,,,,,"When Radiant Fountain enters the battlefield, you gain 2 life.
{T}: Add {C}.",common,,,Land,
248,Rugged Highlands,L,0.0,,,,,"Rugged Highlands enters the battlefield tapped.
When Rugged Highlands enters the battlefield, you gain 1 life.
{T}: Add {R} or {G}.",common,,,Land,
249,Scoured Barrens,L,0.0,,,,,"Scoured Barrens enters the battlefield tapped.
When Scoured Barrens enters the battlefield, you gain 1 life.
{T}: Add {W} or {B}.",common,,,Land,
250,Swiftwater Cliffs,L,0.0,,,,,"Swiftwater Cliffs enters the battlefield tapped.
When Swiftwater Cliffs enters the battlefield, you gain 1 life.
{T}: Add {U} or {R}.",common,,,Land,
251,Temple of Epiphany,L,0.0,,,,,"Temple of Epiphany enters the battlefield tapped.
When Temple of Epiphany enters the battlefield, scry 1.
{T}: Add {U} or {R}.",rare,Scry,,Land,
252,Temple of Malady,L,0.0,,,,,"Temple of Malady enters the battlefield tapped.
When Temple of Malady enters the battlefield, scry 1.
{T}: Add {B} or {G}.",rare,Scry,,Land,
253,Temple of Mystery,L,0.0,,,,,"Temple of Mystery enters the battlefield tapped.
When Temple of Mystery enters the battlefield, scry 1.
{T}: Add {G} or {U}.",rare,Scry,,Land,
254,Temple of Silence,L,0.0,,,,,"Temple of Silence enters the battlefield tapped.
When Temple of Silence enters the battlefield, scry 1.
{T}: Add {W} or {B}.",rare,Scry,,Land,
255,Temple of Triumph,L,0.0,,,,,"Temple of Triumph enters the battlefield tapped.
When Temple of Triumph enters the battlefield, scry 1.
{T}: Add {R} or {W}.",rare,Scry,,Land,
256,Thornwood Falls,L,0.0,,,,,"Thornwood Falls enters the battlefield tapped.
When Thornwood Falls enters the battlefield, you gain 1 life.
{T}: Add {G} or {U}.",common,,,Land,
257,Tranquil Cove,L,0.0,,,,,"Tranquil Cove enters the battlefield tapped.
When Tranquil Cove enters the battlefield, you gain 1 life.
{T}: Add {W} or {U}.",common,,,Land,
258,Wind-Scarred Crag,L,0.0,,,,,"Wind-Scarred Crag enters the battlefield tapped.
When Wind-Scarred Crag enters the battlefield, you gain 1 life.
{T}: Add {R} or {W}.",common,,,Land,
259,"Basri, Devoted Paladin",W,6.0,{4}{W}{W},,,4.0,"[+1]: Put a +1/+1 counter on up to one target creature. It gains vigilance until end of turn.
[−1]: Whenever a creature attacks this turn, put a +1/+1 counter on it.
[−6]: Creatures you control get +2/+2 and gain flying until end of turn.",mythic,,Legendary,Planeswalker,Basri
260,Adherent of Hope,W,2.0,{1}{W},2.0,1.0,,"At the beginning of combat on your turn, if you control a Basri planeswalker, put a +1/+1 counter on Adherent of Hope.",common,,,Creature,"Human, Soldier"
261,Basri's Aegis,W,4.0,{2}{W}{W},,,,"Put a +1/+1 counter on each of up to two target creatures. You may search your library and/or graveyard for a card named Basri, Devoted Paladin, reveal it, and put it into your hand. If you search your library this way, shuffle.",rare,,,Sorcery,
262,Sigiled Contender,W,4.0,{3}{W},3.0,3.0,,Sigiled Contender has lifelink as long as it has a +1/+1 counter on it. (Damage dealt by this creature also causes you to gain that much life.),uncommon,,,Creature,"Human, Warrior"
263,"Teferi, Timeless Voyager",U,6.0,{4}{U}{U},,,4.0,"[+1]: Draw a card.
[−3]: Put target creature on top of its owner's library.
[−8]: Each creature target opponent controls phases out. Until the end of your next turn, they can't phase in. (Treat them and anything attached to them as though they don't exist.)",mythic,,Legendary,Planeswalker,Teferi
264,Historian of Zhalfir,U,4.0,{2}{U}{U},3.0,3.0,,"Whenever Historian of Zhalfir attacks, if you control a Teferi planeswalker, draw a card.",uncommon,,,Creature,"Human, Wizard"
265,Mystic Skyfish,U,3.0,{2}{U},3.0,1.0,,"Whenever you draw your second card each turn, Mystic Skyfish gains flying until end of turn.",common,,,Creature,Fish
266,Teferi's Wavecaster,U,5.0,{3}{U}{U},3.0,3.0,,"Flash
When Teferi's Wavecaster enters the battlefield, you may search your library and/or graveyard for a card named Teferi, Timeless Voyager, reveal it, and put it into your hand. If you search your library this way, shuffle.",rare,Flash,,Creature,"Merfolk, Wizard"
267,"Liliana, Death Mage",B,6.0,{4}{B}{B},,,4.0,"[+1]: Return up to one target creature card from your graveyard to your hand.
[−3]: Destroy target creature. Its controller loses 2 life.
[−7]: Target opponent loses 2 life for each creature card in their graveyard.",mythic,,Legendary,Planeswalker,Liliana
268,Liliana's Scorn,B,5.0,{3}{B}{B},,,,"Destroy target creature. You may search your library and/or graveyard for a card named Liliana, Death Mage, reveal it, and put it into your hand. If you search your library this way, shuffle.",rare,,,Sorcery,
269,Liliana's Scrounger,B,3.0,{2}{B},3.0,2.0,,"At the beginning of each end step, if a creature died this turn, you may put a loyalty counter on a Liliana planeswalker you control.",uncommon,,,Creature,"Human, Wizard"
270,Spirit of Malevolence,B,2.0,{1}{B},2.0,1.0,,"When Spirit of Malevolence dies, each opponent loses 1 life and you gain 1 life.",common,,,Creature,Spirit
271,"Chandra, Flame's Catalyst",R,6.0,{4}{R}{R},,,5.0,"[+1]: Chandra, Flame's Catalyst deals 3 damage to each opponent.
[−2]: You may cast target red instant or sorcery card from your graveyard. If that spell would be put into your graveyard, exile it instead.
[−8]: Discard your hand, then draw seven cards. Until end of turn, you may cast spells from your hand without paying their mana costs.",mythic,,Legendary,Planeswalker,Chandra
272,Chandra's Firemaw,R,5.0,{3}{R}{R},4.0,2.0,,"Haste
When Chandra's Firemaw enters the battlefield, you may search your library and/or graveyard for a card named Chandra, Flame's Catalyst, reveal it, and put it into your hand. If you search your library this way, shuffle.",rare,Haste,,Creature,Hellion
273,Keral Keep Disciples,R,4.0,{2}{R}{R},4.0,3.0,,"Whenever you activate a loyalty ability of a Chandra planeswalker, Keral Keep Disciples deals 1 damage to each opponent.",uncommon,,,Creature,"Human, Monk"
274,Storm Caller,R,3.0,{2}{R},3.0,2.0,,"When Storm Caller enters the battlefield, it deals 2 damage to each opponent.",common,,,Creature,"Ogre, Shaman"
275,"Garruk, Savage Herald",G,6.0,{4}{G}{G},,,5.0,"[+1]: Reveal the top card of your library. If it's a creature card, put it into your hand. Otherwise, put it on the bottom of your library.
[−2]: Target creature you control deals damage equal to its power to another target creature.
[−7]: Until end of turn, creatures you control gain ""You may have this creature assign its combat damage as though it weren't blocked.""",mythic,,Legendary,Planeswalker,Garruk
276,Garruk's Warsteed,G,5.0,{3}{G}{G},3.0,5.0,,"Vigilance
When Garruk's Warsteed enters the battlefield, you may search your library and/or graveyard for a card named Garruk, Savage Herald, reveal it, and put it into your hand. If you search your library this way, shuffle.",rare,Vigilance,,Creature,Rhino
277,Predatory Wurm,G,4.0,{3}{G},4.0,4.0,,"Vigilance (Attacking doesn't cause this creature to tap.)
Predatory Wurm gets +2/+2 as long as you control a Garruk planeswalker.",uncommon,Vigilance,,Creature,Wurm
278,Wildwood Patrol,G,3.0,{2}{G},4.0,2.0,,Trample (This creature can deal excess combat damage to the player or planeswalker it's attacking.),common,Trample,,Creature,"Centaur, Scout"
