,name,colors,manaValue,manaCost,power,toughness,loyalty,text,rarity,keywords,supertypes,types,subtypes
122,Skeleton Archer,B,4.0,{3}{B},3.0,3.0,,"When Skeleton Archer enters the battlefield, it deals 1 damage to any target.",common,,,Creature,"Skeleton, Archer"
123,Tavern Swindler,B,2.0,{1}{B},2.0,2.0,,"{T}, Pay 3 life: Flip a coin. If you win the flip, you gain 6 life.",uncommon,,,Creature,"Human, Rogue"
124,Thieves' Guild Enforcer,B,1.0,{B},1.0,1.0,,"Flash
Whenever Thieves' Guild Enforcer or another Rogue enters the battlefield under your control, each opponent mills two cards.
As long as an opponent has eight or more cards in their graveyard, Thieves' Guild Enforcer gets +2/+1 and has deathtouch.",rare,"Flash, Mill",,Creature,"Human, Rogue"
125,Village Rites,B,1.0,{B},,,,"As an additional cost to cast this spell, sacrifice a creature.
Draw two cards.",common,,,Instant,
126,"Vito, Thorn of the Dusk Rose",B,3.0,{2}{B},1.0,3.0,,"Whenever you gain life, target opponent loses that much life.
{3}{B}{B}: Creatures you control gain lifelink until end of turn.",rare,,Legendary,Creature,"Vampire, Cleric"
127,Walking Corpse,B,2.0,{1}{B},2.0,2.0,,,common,,,Creature,Zombie
128,Witch's Cauldron,B,1.0,{B},,,,"{1}{B}, {T}, Sacrifice a creature: You gain 1 life and draw a card.",uncommon,,,Artifact,
129,Battle-Rattle Shaman,R,4.0,{3}{R},2.0,2.0,,"At the beginning of combat on your turn, you may have target creature get +2/+0 until end of turn.",uncommon,,,Creature,"Goblin, Shaman"
130,Bolt Hound,R,3.0,{2}{R},2.0,2.0,,"Haste (This creature can attack and {T} as soon as it comes under your control.)
Whenever Bolt Hound attacks, other creatures you control get +1/+0 until end of turn.",uncommon,Haste,,Creature,"Elemental, Dog"
131,Bone Pit Brute,R,6.0,{4}{R}{R},4.0,5.0,,"Menace (This creature can't be blocked except by two or more creatures.)
When Bone Pit Brute enters the battlefield, target creature gets +4/+0 until end of turn.",common,Menace,,Creature,Cyclops
132,Brash Taunter,R,5.0,{4}{R},1.0,1.0,,"Indestructible
Whenever Brash Taunter is dealt damage, it deals that much damage to target opponent.
{2}{R}, {T}: Brash Taunter fights another target creature.",rare,"Fight, Indestructible",,Creature,Goblin
133,Burn Bright,R,3.0,{2}{R},,,,Creatures you control get +2/+0 until end of turn.,common,,,Instant,
134,"Chandra, Heart of Fire",R,5.0,{3}{R}{R},,,5.0,"[+1]: Discard your hand, then exile the top three cards of your library. Until end of turn, you may play cards exiled this way.
[+1]: Chandra, Heart of Fire deals 2 damage to any target.
[−9]: Search your graveyard and library for any number of red instant and/or sorcery cards, exile them, then shuffle. You may cast them this turn. Add six {R}.",mythic,,Legendary,Planeswalker,Chandra
135,Chandra's Incinerator,R,6.0,{5}{R},6.0,6.0,,"This spell costs {X} less to cast, where X is the total amount of noncombat damage dealt to your opponents this turn.
Trample
Whenever a source you control deals noncombat damage to an opponent, Chandra's Incinerator deals that much damage to target creature or planeswalker that player controls.",rare,Trample,,Creature,Elemental
136,Chandra's Magmutt,R,2.0,{1}{R},2.0,2.0,,{T}: Chandra's Magmutt deals 1 damage to target player or planeswalker.,common,,,Creature,"Elemental, Dog"
137,Chandra's Pyreling,R,2.0,{1}{R},1.0,3.0,,"Whenever a source you control deals noncombat damage to an opponent, Chandra's Pyreling gets +1/+0 and gains double strike until end of turn. (It deals both first-strike and regular combat damage.)",uncommon,,,Creature,"Elemental, Lizard"
138,Conspicuous Snoop,R,2.0,{R}{R},2.0,2.0,,"Play with the top card of your library revealed.
You may cast Goblin spells from the top of your library.
As long as the top card of your library is a Goblin card, Conspicuous Snoop has all activated abilities of that card.",rare,,,Creature,"Goblin, Rogue"
139,Crash Through,R,1.0,{R},,,,"Creatures you control gain trample until end of turn. (A creature with trample can deal excess combat damage to the player or planeswalker it's attacking.)
Draw a card.",common,,,Sorcery,
140,Destructive Tampering,R,3.0,{2}{R},,,,"Choose one —
• Destroy target artifact.
• Creatures without flying can't block this turn.",common,,,Sorcery,
141,Double Vision,R,5.0,{3}{R}{R},,,,"Whenever you cast your first instant or sorcery spell each turn, copy that spell. You may choose new targets for the copy.",rare,,,Enchantment,
142,Fiery Emancipation,R,6.0,{3}{R}{R}{R},,,,"If a source you control would deal damage to a permanent or player, it deals triple that damage to that permanent or player instead.",mythic,,,Enchantment,
143,Furious Rise,R,3.0,{2}{R},,,,"At the beginning of your end step, if you control a creature with power 4 or greater, exile the top card of your library. You may play that card until you exile another card with Furious Rise.",uncommon,,,Enchantment,
144,Furor of the Bitten,R,1.0,{R},,,,"Enchant creature
Enchanted creature gets +2/+2 and attacks each combat if able.",common,Enchant,,Enchantment,Aura
145,"Gadrak, the Crown-Scourge",R,3.0,{2}{R},5.0,4.0,,"Flying
Gadrak, the Crown-Scourge can't attack unless you control four or more artifacts.
At the beginning of your end step, create a Treasure token for each nontoken creature that died this turn. (It's an artifact with ""{T}, Sacrifice this artifact: Add one mana of any color."")",rare,Flying,Legendary,Creature,Dragon
146,Goblin Arsonist,R,1.0,{R},1.0,1.0,,"When Goblin Arsonist dies, you may have it deal 1 damage to any target.",common,,,Creature,"Goblin, Shaman"
147,Goblin Wizardry,R,4.0,{3}{R},,,,"Create two 1/1 red Goblin Wizard creature tokens with prowess. (Whenever you cast a noncreature spell, they get +1/+1 until end of turn.)",common,,,Instant,
148,Havoc Jester,R,5.0,{4}{R},5.0,5.0,,"Whenever you sacrifice a permanent, Havoc Jester deals 1 damage to any target.",uncommon,,,Creature,Devil
149,Heartfire Immolator,R,2.0,{1}{R},2.0,2.0,,"Prowess (Whenever you cast a noncreature spell, this creature gets +1/+1 until end of turn.)
{R}, Sacrifice Heartfire Immolator: It deals damage equal to its power to target creature or planeswalker.",uncommon,Prowess,,Creature,"Human, Wizard"
150,Hellkite Punisher,R,7.0,{5}{R}{R},6.0,6.0,,"Flying
{R}: Hellkite Punisher gets +1/+0 until end of turn.",uncommon,Flying,,Creature,Dragon
151,Hobblefiend,R,2.0,{1}{R},2.0,1.0,,"Trample (This creature can deal excess combat damage to the player or planeswalker it's attacking.)
{1}, Sacrifice another creature: Put a +1/+1 counter on Hobblefiend.",common,Trample,,Creature,Devil
152,Igneous Cur,R,2.0,{1}{R},1.0,2.0,,{1}{R}: Igneous Cur gets +2/+0 until end of turn.,common,,,Creature,"Elemental, Dog"
153,Kinetic Augur,R,4.0,{3}{R},,4.0,,"Trample (This creature can deal excess combat damage to the player or planeswalker it's attacking.)
Kinetic Augur's power is equal to the number of instant and sorcery cards in your graveyard.
When Kinetic Augur enters the battlefield, discard up to two cards, then draw that many cards.",uncommon,Trample,,Creature,"Human, Shaman"
154,Onakke Ogre,R,3.0,{2}{R},4.0,2.0,,,common,,,Creature,"Ogre, Warrior"
155,Pitchburn Devils,R,5.0,{4}{R},3.0,3.0,,"When Pitchburn Devils dies, it deals 3 damage to any target.",common,,,Creature,Devil
156,Sanctum of Shattered Heights,R,3.0,{2}{R},,,,"{1}, Discard a land card or Shrine card: Sanctum of Shattered Heights deals X damage to target creature or planeswalker, where X is the number of Shrines you control.",uncommon,,Legendary,Enchantment,Shrine
157,Scorching Dragonfire,R,2.0,{1}{R},,,,"Scorching Dragonfire deals 3 damage to target creature or planeswalker. If that creature or planeswalker would die this turn, exile it instead.",common,,,Instant,
158,Shock,R,1.0,{R},,,,Shock deals 2 damage to any target.,common,,,Instant,
159,Soul Sear,R,3.0,{2}{R},,,,Soul Sear deals 5 damage to target creature or planeswalker. That permanent loses indestructible until end of turn.,uncommon,,,Instant,
160,Spellgorger Weird,R,3.0,{2}{R},2.0,2.0,,"Whenever you cast a noncreature spell, put a +1/+1 counter on Spellgorger Weird.",common,,,Creature,Weird
161,"Subira, Tulzidi Caravanner",R,3.0,{2}{R},2.0,3.0,,"Haste
{1}: Another target creature with power 2 or less can't be blocked this turn.
{1}{R}, {T}, Discard your hand: Until end of turn, whenever a creature you control with power 2 or less deals combat damage to a player, draw a card.",rare,Haste,Legendary,Creature,"Human, Shaman"
162,Sure Strike,R,2.0,{1}{R},,,,Target creature gets +3/+0 and gains first strike until end of turn.,common,,,Instant,
163,Terror of the Peaks,R,5.0,{3}{R}{R},5.0,4.0,,"Flying
Spells your opponents cast that target Terror of the Peaks cost an additional 3 life to cast.
Whenever another creature enters the battlefield under your control, Terror of the Peaks deals damage equal to that creature's power to any target.",mythic,Flying,,Creature,Dragon
164,Thrill of Possibility,R,2.0,{1}{R},,,,"As an additional cost to cast this spell, discard a card.
Draw two cards.",common,,,Instant,
165,Traitorous Greed,R,4.0,{3}{R},,,,Gain control of target creature until end of turn. Untap that creature. It gains haste until end of turn. Add two mana of any one color. (The creature can attack and {T} this turn.),uncommon,,,Sorcery,
166,Transmogrify,R,4.0,{3}{R},,,,"Exile target creature. That creature's controller reveals cards from the top of their library until they reveal a creature card. That player puts that card onto the battlefield, then shuffles the rest into their library.",rare,,,Sorcery,
167,Turn to Slag,R,5.0,{3}{R}{R},,,,Turn to Slag deals 5 damage to target creature. Destroy all Equipment attached to that creature.,common,,,Sorcery,
168,Turret Ogre,R,4.0,{3}{R},4.0,3.0,,"Reach (This creature can block creatures with flying.)
When Turret Ogre enters the battlefield, if you control another creature with power 4 or greater, Turret Ogre deals 2 damage to each opponent.",common,Reach,,Creature,"Ogre, Warrior"
169,Unleash Fury,R,2.0,{1}{R},,,,Double the power of target creature until end of turn.,uncommon,,,Instant,
170,Volcanic Geyser,R,2.0,{X}{R}{R},,,,Volcanic Geyser deals X damage to any target.,uncommon,,,Instant,
171,Volcanic Salvo,R,12.0,{10}{R}{R},,,,"This spell costs {X} less to cast, where X is the total power of creatures you control.
Volcanic Salvo deals 6 damage to each of up to two target creatures and/or planeswalkers.",rare,,,Sorcery,
172,"Azusa, Lost but Seeking",G,3.0,{2}{G},1.0,2.0,,You may play two additional lands on each of your turns.,rare,,Legendary,Creature,"Human, Monk"
173,Burlfist Oak,G,4.0,{2}{G}{G},2.0,3.0,,"Whenever you draw a card, Burlfist Oak gets +2/+2 until end of turn.",uncommon,,,Creature,Treefolk
174,Canopy Stalker,G,4.0,{3}{G},4.0,2.0,,"Canopy Stalker must be blocked if able.
When Canopy Stalker dies, you gain 1 life for each creature that died this turn.",uncommon,,,Creature,Cat
175,Colossal Dreadmaw,G,6.0,{4}{G}{G},6.0,6.0,,Trample (This creature can deal excess combat damage to the player or planeswalker it's attacking.),common,Trample,,Creature,Dinosaur
176,Cultivate,G,3.0,{2}{G},,,,"Search your library for up to two basic land cards, reveal those cards, put one onto the battlefield tapped and the other into your hand, then shuffle.",uncommon,,,Sorcery,
177,Drowsing Tyrannodon,G,2.0,{1}{G},3.0,3.0,,"Defender (This creature can't attack.)
As long as you control a creature with power 4 or greater, Drowsing Tyrannodon can attack as though it didn't have defender.",common,Defender,,Creature,Dinosaur
178,Elder Gargaroth,G,5.0,{3}{G}{G},6.0,6.0,,"Vigilance, reach, trample
Whenever Elder Gargaroth attacks or blocks, choose one —
• Create a 3/3 green Beast creature token.
• You gain 3 life.
• Draw a card.",mythic,"Reach, Trample, Vigilance",,Creature,Beast
179,Feline Sovereign,G,3.0,{2}{G},2.0,3.0,,"Other Cats you control get +1/+1 and have protection from Dogs.
Whenever one or more Cats you control deal combat damage to a player, destroy up to one target artifact or enchantment that player controls.",rare,,,Creature,Cat
180,Fierce Empath,G,3.0,{2}{G},1.0,1.0,,"When Fierce Empath enters the battlefield, you may search your library for a creature card with mana value 6 or greater, reveal it, put it into your hand, then shuffle.",uncommon,,,Creature,Elf
181,Fungal Rebirth,G,3.0,{2}{G},,,,"Return target permanent card from your graveyard to your hand. If a creature died this turn, create two 1/1 green Saproling creature tokens.",uncommon,,,Instant,
182,"Garruk, Unleashed",G,4.0,{2}{G}{G},,,4.0,"[+1]: Up to one target creature gets +3/+3 and gains trample until end of turn.
[−2]: Create a 3/3 green Beast creature token. Then if an opponent controls more creatures than you, put a loyalty counter on Garruk, Unleashed.
[−7]: You get an emblem with ""At the beginning of your end step, you may search your library for a creature card, put it onto the battlefield, then shuffle.""",mythic,,Legendary,Planeswalker,Garruk
183,Garruk's Gorehorn,G,5.0,{4}{G},7.0,3.0,,,common,,,Creature,Beast
184,Garruk's Harbinger,G,3.0,{1}{G}{G},4.0,3.0,,"Hexproof from black
Whenever Garruk's Harbinger deals combat damage to a player or planeswalker, look at that many cards from the top of your library. You may reveal a creature card or Garruk planeswalker card from among them and put it into your hand. Put the rest on the bottom of your library in a random order.",rare,"Hexproof, Hexproof from",,Creature,Beast
185,Garruk's Uprising,G,3.0,{2}{G},,,,"When Garruk's Uprising enters the battlefield, if you control a creature with power 4 or greater, draw a card.
Creatures you control have trample. (They can deal excess combat damage to the player or planeswalker they're attacking.)
Whenever a creature with power 4 or greater enters the battlefield under your control, draw a card.",uncommon,,,Enchantment,
186,Gnarled Sage,G,5.0,{3}{G}{G},4.0,4.0,,"Reach (This creature can block creatures with flying.)
As long as you've drawn two or more cards this turn, Gnarled Sage gets +0/+2 and has vigilance. (Attacking doesn't cause it to tap.)",common,Reach,,Creature,"Treefolk, Druid"
187,Heroic Intervention,G,2.0,{1}{G},,,,Permanents you control gain hexproof and indestructible until end of turn.,rare,,,Instant,
188,Hunter's Edge,G,4.0,{3}{G},,,,Put a +1/+1 counter on target creature you control. Then that creature deals damage equal to its power to target creature you don't control.,common,,,Sorcery,
189,Invigorating Surge,G,3.0,{2}{G},,,,"Put a +1/+1 counter on target creature you control, then double the number of +1/+1 counters on that creature.",uncommon,,,Instant,
190,"Jolrael, Mwonvuli Recluse",G,2.0,{1}{G},1.0,2.0,,"Whenever you draw your second card each turn, create a 2/2 green Cat creature token.
{4}{G}{G}: Until end of turn, creatures you control have base power and toughness X/X, where X is the number of cards in your hand.",rare,,Legendary,Creature,"Human, Druid"
191,Life Goes On,G,1.0,{G},,,,"You gain 4 life. If a creature died this turn, you gain 8 life instead.",common,,,Instant,
192,Llanowar Visionary,G,3.0,{2}{G},2.0,2.0,,"When Llanowar Visionary enters the battlefield, draw a card.
{T}: Add {G}.",common,,,Creature,"Elf, Druid"
193,Ornery Dilophosaur,G,4.0,{3}{G},2.0,2.0,,"Deathtouch (Any amount of damage this deals to a creature is enough to destroy it.)
Whenever Ornery Dilophosaur attacks, if you control a creature with power 4 or greater, Ornery Dilophosaur gets +2/+2 until end of turn.",common,Deathtouch,,Creature,Dinosaur
194,Portcullis Vine,G,1.0,{G},0.0,3.0,,"Defender (This creature can't attack.)
{2}, {T}, Sacrifice a creature with defender: Draw a card.",common,Defender,,Creature,"Plant, Wall"
195,Pridemalkin,G,3.0,{2}{G},2.0,1.0,,"When Pridemalkin enters the battlefield, put a +1/+1 counter on target creature you control.
Each creature you control with a +1/+1 counter on it has trample. (They can deal excess combat damage to the player or planeswalker they're attacking.)",common,,,Creature,Cat
196,Primal Might,G,1.0,{X}{G},,,,Target creature you control gets +X/+X until end of turn. Then it fights up to one target creature you don't control.,rare,Fight,,Sorcery,
197,Quirion Dryad,G,2.0,{1}{G},1.0,1.0,,"Whenever you cast a spell that's white, blue, black, or red, put a +1/+1 counter on Quirion Dryad.",uncommon,,,Creature,Dryad
198,Ranger's Guile,G,1.0,{G},,,,Target creature you control gets +1/+1 and gains hexproof until end of turn. (It can't be the target of spells or abilities your opponents control.),common,,,Instant,
199,Return to Nature,G,2.0,{1}{G},,,,"Choose one —
• Destroy target artifact.
• Destroy target enchantment.
• Exile target card from a graveyard.",common,,,Instant,
200,Run Afoul,G,1.0,{G},,,,Target opponent sacrifices a creature with flying.,common,,,Instant,
201,Sabertooth Mauler,G,4.0,{3}{G},3.0,3.0,,"At the beginning of your end step, if a creature died this turn, put a +1/+1 counter on Sabertooth Mauler and untap it.",common,,,Creature,Cat
202,Sanctum of Fruitful Harvest,G,3.0,{2}{G},,,,"At the beginning of your precombat main phase, add X mana of any one color, where X is the number of Shrines you control.",uncommon,,Legendary,Enchantment,Shrine
203,Scavenging Ooze,G,2.0,{1}{G},2.0,2.0,,"{G}: Exile target card from a graveyard. If it was a creature card, put a +1/+1 counter on Scavenging Ooze and you gain 1 life.",rare,,,Creature,Ooze
204,Setessan Training,G,2.0,{1}{G},,,,"Enchant creature you control
When Setessan Training enters the battlefield, draw a card.
Enchanted creature gets +1/+0 and has trample. (It can deal excess combat damage to the player or planeswalker it's attacking.)",common,Enchant,,Enchantment,Aura
205,Skyway Sniper,G,1.0,{G},1.0,2.0,,"Reach (This creature can block creatures with flying.)
{2}{G}: Skyway Sniper deals 1 damage to target creature with flying.",uncommon,Reach,,Creature,"Elf, Archer"
206,Snarespinner,G,2.0,{1}{G},1.0,3.0,,"Reach (This creature can block creatures with flying.)
Whenever Snarespinner blocks a creature with flying, Snarespinner gets +2/+0 until end of turn.",common,Reach,,Creature,Spider
207,Sporeweb Weaver,G,3.0,{2}{G},1.0,4.0,,"Reach, hexproof from blue
Whenever Sporeweb Weaver is dealt damage, you gain 1 life and create a 1/1 green Saproling creature token.",rare,"Hexproof, Hexproof from, Reach",,Creature,Spider
208,Thrashing Brontodon,G,3.0,{1}{G}{G},3.0,4.0,,"{1}, Sacrifice Thrashing Brontodon: Destroy target artifact or enchantment.",uncommon,,,Creature,Dinosaur
209,Titanic Growth,G,2.0,{1}{G},,,,Target creature gets +4/+4 until end of turn.,common,,,Instant,
210,Track Down,G,2.0,{1}{G},,,,"Scry 3, then reveal the top card of your library. If it's a creature or land card, draw a card. (To scry 3, look at the top three cards of your library, then put any number of them on the bottom of your library and the rest on top in any order.)",common,Scry,,Sorcery,
211,Trufflesnout,G,3.0,{2}{G},2.0,2.0,,"When Trufflesnout enters the battlefield, choose one —
• Put a +1/+1 counter on Trufflesnout.
• You gain 4 life.",common,,,Creature,Boar
212,Warden of the Woods,G,6.0,{4}{G}{G},5.0,7.0,,"Vigilance (Attacking doesn't cause this creature to tap.)
Whenever Warden of the Woods becomes the target of a spell or ability an opponent controls, you may draw two cards.",uncommon,Vigilance,,Creature,Treefolk
213,Wildwood Scourge,G,1.0,{X}{G},0.0,0.0,,"Wildwood Scourge enters the battlefield with X +1/+1 counters on it.
Whenever one or more +1/+1 counters are put on another non-Hydra creature you control, put a +1/+1 counter on Wildwood Scourge.",uncommon,,,Creature,Hydra
214,Alpine Houndmaster,"R, W",2.0,{R}{W},2.0,2.0,,"When Alpine Houndmaster enters the battlefield, you may search your library for a card named Alpine Watchdog and/or a card named Igneous Cur, reveal them, put them into your hand, then shuffle.
Whenever Alpine Houndmaster attacks, it gets +X/+0 until end of turn, where X is the number of other attacking creatures.",uncommon,,,Creature,"Human, Warrior"
215,Conclave Mentor,"G, W",2.0,{G}{W},2.0,2.0,,"If one or more +1/+1 counters would be put on a creature you control, that many plus one +1/+1 counters are put on that creature instead.
When Conclave Mentor dies, you gain life equal to its power.",uncommon,,,Creature,"Centaur, Cleric"
216,Dire Fleet Warmonger,"B, R",3.0,{1}{B}{R},3.0,3.0,,"At the beginning of combat on your turn, you may sacrifice another creature. If you do, Dire Fleet Warmonger gets +2/+2 and gains trample until end of turn. (It can deal excess combat damage to the player or planeswalker it's attacking.)",uncommon,,,Creature,"Orc, Pirate"
217,Experimental Overload,"R, U",4.0,{2}{U}{R},,,,"Create an X/X blue and red Weird creature token, where X is the number of instant and sorcery cards in your graveyard. Then you may return an instant or sorcery card from your graveyard to your hand. Exile Experimental Overload.",uncommon,,,Sorcery,
218,Indulging Patrician,"B, W",3.0,{1}{W}{B},1.0,4.0,,"Flying
Lifelink (Damage dealt by this creature also causes you to gain that much life.)
At the beginning of your end step, if you gained 3 or more life this turn, each opponent loses 3 life.",uncommon,"Flying, Lifelink",,Creature,"Vampire, Noble"
219,Leafkin Avenger,"G, R",4.0,{2}{R}{G},4.0,3.0,,"{T}: Add {G} for each creature with power 4 or greater you control.
{7}{R}: Leafkin Avenger deals damage equal to its power to target player or planeswalker.",uncommon,,,Creature,"Elemental, Druid"
220,Lorescale Coatl,"G, U",3.0,{1}{G}{U},2.0,2.0,,"Whenever you draw a card, put a +1/+1 counter on Lorescale Coatl.",uncommon,,,Creature,Snake
221,"Niambi, Esteemed Speaker","U, W",2.0,{W}{U},2.0,1.0,,"Flash
When Niambi, Esteemed Speaker enters the battlefield, you may return another target creature you control to its owner's hand. If you do, you gain life equal to that creature's mana value.
{1}{W}{U}, {T}, Discard a legendary card: Draw two cards.",rare,Flash,Legendary,Creature,"Human, Cleric"
222,Obsessive Stitcher,"B, U",3.0,{1}{U}{B},0.0,3.0,,"{T}: Draw a card, then discard a card.
{2}{U}{B}, {T}, Sacrifice Obsessive Stitcher: Return target creature card from your graveyard to the battlefield.",uncommon,,,Creature,"Human, Wizard"
223,"Radha, Heart of Keld","G, R",3.0,{1}{R}{G},3.0,3.0,,"As long as it's your turn, Radha, Heart of Keld has first strike.
You may look at the top card of your library any time, and you may play lands from the top of your library.
{4}{R}{G}: Radha gets +X/+X until end of turn, where X is the number of lands you control.",rare,,Legendary,Creature,"Elf, Warrior"
224,Sanctum of All,"B, G, R, U, W",5.0,{W}{U}{B}{R}{G},,,,"At the beginning of your upkeep, you may search your library and/or graveyard for a Shrine card and put it onto the battlefield. If you search your library this way, shuffle.
If an ability of another Shrine you control triggers while you control six or more Shrines, that ability triggers an additional time.",rare,,Legendary,Enchantment,Shrine
225,Twinblade Assassins,"B, G",5.0,{3}{B}{G},5.0,4.0,,"At the beginning of your end step, if a creature died this turn, draw a card.",uncommon,,,Creature,"Elf, Assassin"
226,Watcher of the Spheres,"U, W",2.0,{W}{U},2.0,2.0,,"Flying
Creature spells with flying you cast cost {1} less to cast.
Whenever another creature with flying enters the battlefield under your control, Watcher of the Spheres gets +1/+1 until end of turn.",uncommon,Flying,,Creature,"Bird, Wizard"
227,Chromatic Orrery,C,7.0,{7},,,,"You may spend mana as though it were mana of any color.
{T}: Add {C}{C}{C}{C}{C}.
{5}, {T}: Draw a card for each color among permanents you control.",mythic,,Legendary,Artifact,
228,Chrome Replicator,C,5.0,{5},4.0,4.0,,"When Chrome Replicator enters the battlefield, if you control two or more nonland, nontoken permanents with the same name as one another, create a 4/4 colorless Construct artifact creature token.",uncommon,,,"Artifact, Creature",Construct
229,Epitaph Golem,C,5.0,{5},3.0,5.0,,{2}: Put target card from your graveyard on the bottom of your library.,uncommon,,,"Artifact, Creature",Golem
230,Forgotten Sentinel,C,4.0,{4},4.0,3.0,,Forgotten Sentinel enters the battlefield tapped.,common,,,"Artifact, Creature",Golem
231,Mazemind Tome,C,2.0,{2},,,,"{T}, Put a page counter on Mazemind Tome: Scry 1.
{2}, {T}, Put a page counter on Mazemind Tome: Draw a card.
When there are four or more page counters on Mazemind Tome, exile it. If you do, you gain 4 life.",rare,Scry,,Artifact,
232,Meteorite,C,5.0,{5},,,,"When Meteorite enters the battlefield, it deals 2 damage to any target.
{T}: Add one mana of any color.",uncommon,,,Artifact,
233,Palladium Myr,C,3.0,{3},2.0,2.0,,{T}: Add {C}{C}.,uncommon,,,"Artifact, Creature",Myr
234,Prismite,C,2.0,{2},2.0,1.0,,{2}: Add one mana of any color.,common,,,"Artifact, Creature",Golem
235,Short Sword,C,1.0,{1},,,,"Equipped creature gets +1/+1.
Equip {1} ({1}: Attach to target creature you control. Equip only as a sorcery.)",common,Equip,,Artifact,Equipment
236,Silent Dart,C,1.0,{1},,,,"{4}, {T}, Sacrifice Silent Dart: It deals 3 damage to target creature.",common,,,Artifact,
237,Skyscanner,C,3.0,{3},1.0,1.0,,"Flying
When Skyscanner enters the battlefield, draw a card.",common,Flying,,"Artifact, Creature",Thopter
238,Solemn Simulacrum,C,4.0,{4},2.0,2.0,,"When Solemn Simulacrum enters the battlefield, you may search your library for a basic land card, put that card onto the battlefield tapped, then shuffle.
When Solemn Simulacrum dies, you may draw a card.",rare,,,"Artifact, Creature",Golem
239,Sparkhunter Masticore,C,3.0,{3},3.0,4.0,,"As an additional cost to cast this spell, discard a card.
Protection from planeswalkers
{1}: Sparkhunter Masticore deals 1 damage to target planeswalker.
{3}: Sparkhunter Masticore gains indestructible until end of turn.",rare,Protection,,"Artifact, Creature",Masticore
