,name,colors,manaValue,manaCost,power,toughness,loyalty,text,rarity,keywords,supertypes,types
220,"Kroxa, Titan of Death's Hunger","B, R",2.0,{B}{R},6.0,6.0,,"When Kroxa enters the battlefield, sacrifice it unless it escaped.
Whenever Kroxa enters the battlefield or attacks, each opponent discards a card, then each opponent who didn't discard a nonland card this way loses 3 life.
Escape—{B}{B}{R}{R}, Exile five other cards from your graveyard. (You may cast this card from your graveyard for its escape cost.)",mythic,Escape,Legendary,Creature
221,"Kunoros, Hound of Athreos","B, W",3.0,{1}{W}{B},3.0,3.0,,"Vigilance, menace, lifelink
Creature cards in graveyards can't enter the battlefield.
Players can't cast spells from graveyards.",rare,"Lifelink, Menace, Vigilance",Legendary,Creature
222,Mischievous Chimera,"R, U",2.0,{U}{R},2.0,2.0,,"Flying
Whenever you cast your first spell during each opponent's turn, Mischievous Chimera deals 1 damage to each opponent. Scry 1.",uncommon,"Flying, Scry",,"Enchantment, Creature"
223,"Polukranos, Unchained","B, G",4.0,{2}{B}{G},0.0,0.0,,"Polukranos enters the battlefield with six +1/+1 counters on it. It escapes with twelve +1/+1 counters on it instead.
If damage would be dealt to Polukranos while it has a +1/+1 counter on it, prevent that damage and remove that many +1/+1 counters from it.
{1}{B}{G}: Polukranos fights another target creature.
Escape—{4}{B}{G}, Exile six other cards from your graveyard.",mythic,"Escape, Fight",Legendary,Creature
224,Rise to Glory,"B, W",5.0,{3}{W}{B},,,,"Choose one or both —
• Return target creature card from your graveyard to the battlefield.
• Return target Aura card from your graveyard to the battlefield.",uncommon,,,Sorcery
225,"Siona, Captain of the Pyleas","G, W",3.0,{1}{G}{W},2.0,2.0,,"When Siona, Captain of the Pyleas enters the battlefield, look at the top seven cards of your library. You may reveal an Aura card from among them and put it into your hand. Put the rest on the bottom of your library in a random order.
Whenever an Aura you control becomes attached to a creature you control, create a 1/1 white Human Soldier creature token.",uncommon,,Legendary,Creature
226,Slaughter-Priest of Mogis,"B, R",2.0,{B}{R},2.0,2.0,,"Whenever you sacrifice a permanent, Slaughter-Priest of Mogis gets +2/+0 until end of turn.
{2}, Sacrifice another creature or an enchantment: Slaughter-Priest of Mogis gains first strike until end of turn.",uncommon,,,Creature
227,Staggering Insight,"U, W",2.0,{W}{U},,,,"Enchant creature
Enchanted creature gets +1/+1 and has lifelink and ""Whenever this creature deals combat damage to a player, draw a card.""",uncommon,Enchant,,Enchantment
228,"Uro, Titan of Nature's Wrath","G, U",3.0,{1}{G}{U},6.0,6.0,,"When Uro enters the battlefield, sacrifice it unless it escaped.
Whenever Uro enters the battlefield or attacks, you gain 3 life and draw a card, then you may put a land card from your hand onto the battlefield.
Escape—{G}{G}{U}{U}, Exile five other cards from your graveyard. (You may cast this card from your graveyard for its escape cost.)",mythic,Escape,Legendary,Creature
229,Warden of the Chained,"G, R",3.0,{1}{R}{G},4.0,4.0,,"Trample
Warden of the Chained can't attack unless you control another creature with power 4 or greater.",uncommon,Trample,,Creature
230,Altar of the Pantheon,,3.0,{3},,,,"Your devotion to each color and each combination of colors is increased by one.
{T}: Add one mana of any color. If you control a God, a Demigod, or a legendary enchantment, you gain 1 life.",common,,,Artifact
231,Bronze Sword,,1.0,{1},,,,"Equipped creature gets +2/+0.
Equip {3} ({3}: Attach to target creature you control. Equip only as a sorcery.)",common,Equip,,Artifact
232,Entrancing Lyre,,3.0,{3},,,,"You may choose not to untap Entrancing Lyre during your untap step.
{X}, {T}: Tap target creature with power X or less. It doesn't untap during its controller's untap step for as long as Entrancing Lyre remains tapped.",uncommon,,,Artifact
233,Mirror Shield,,2.0,{2},,,,"Equipped creature gets +0/+2 and has hexproof and ""Whenever a creature with deathtouch blocks or becomes blocked by this creature, destroy that creature.""
Equip {2} ({2}: Attach to target creature you control. Equip only as a sorcery.)",uncommon,Equip,,Artifact
234,Nyx Lotus,,4.0,{4},,,,"Nyx Lotus enters the battlefield tapped.
{T}: Choose a color. Add an amount of mana of that color equal to your devotion to that color. (Your devotion to a color is the number of mana symbols of that color in the mana costs of permanents you control.)",rare,,Legendary,Artifact
235,Shadowspear,,1.0,{1},,,,"Equipped creature gets +1/+1 and has trample and lifelink.
{1}: Permanents your opponents control lose hexproof and indestructible until end of turn.
Equip {2}",rare,Equip,Legendary,Artifact
236,Soul-Guide Lantern,,1.0,{1},,,,"When Soul-Guide Lantern enters the battlefield, exile target card from a graveyard.
{T}, Sacrifice Soul-Guide Lantern: Exile each opponent's graveyard.
{1}, {T}, Sacrifice Soul-Guide Lantern: Draw a card.",uncommon,,,Artifact
237,Thaumaturge's Familiar,,3.0,{3},1.0,3.0,,"Flying
When Thaumaturge's Familiar enters the battlefield, scry 1.",common,"Flying, Scry",,"Artifact, Creature"
238,Thundering Chariot,,4.0,{4},3.0,3.0,,"First strike, trample, haste
Crew 1 (Tap any number of creatures you control with total power 1 or more: This Vehicle becomes an artifact creature until end of turn.)",uncommon,"Crew, First strike, Haste, Trample",,Artifact
239,Traveler's Amulet,,1.0,{1},,,,"{1}, Sacrifice Traveler's Amulet: Search your library for a basic land card, reveal it, put it into your hand, then shuffle.",common,,,Artifact
240,Wings of Hubris,,2.0,{2},,,,"Equipped creature has flying.
Sacrifice Wings of Hubris: Equipped creature can't be blocked this turn. Sacrifice it at the beginning of the next end step.
Equip {1} ({1}: Attach to target creature you control. Equip only as a sorcery.)",common,Equip,,Artifact
241,Field of Ruin,,0.0,,,,,"{T}: Add {C}.
{2}, {T}, Sacrifice Field of Ruin: Destroy target nonbasic land an opponent controls. Each player searches their library for a basic land card, puts it onto the battlefield, then shuffles.",uncommon,,,Land
242,Labyrinth of Skophos,,0.0,,,,,"{T}: Add {C}.
{4}, {T}: Remove target attacking or blocking creature from combat.",rare,,,Land
243,Temple of Abandon,,0.0,,,,,"Temple of Abandon enters the battlefield tapped.
When Temple of Abandon enters the battlefield, scry 1.
{T}: Add {R} or {G}.",rare,Scry,,Land
244,Temple of Deceit,,0.0,,,,,"Temple of Deceit enters the battlefield tapped.
When Temple of Deceit enters the battlefield, scry 1.
{T}: Add {U} or {B}.",rare,Scry,,Land
245,Temple of Enlightenment,,0.0,,,,,"Temple of Enlightenment enters the battlefield tapped.
When Temple of Enlightenment enters the battlefield, scry 1.
{T}: Add {W} or {U}.",rare,Scry,,Land
246,Temple of Malice,,0.0,,,,,"Temple of Malice enters the battlefield tapped.
When Temple of Malice enters the battlefield, scry 1.
{T}: Add {B} or {R}.",rare,Scry,,Land
247,Temple of Plenty,,0.0,,,,,"Temple of Plenty enters the battlefield tapped.
When Temple of Plenty enters the battlefield, scry 1.
{T}: Add {G} or {W}.",rare,Scry,,Land
248,Unknown Shores,,0.0,,,,,"{T}: Add {C}.
{1}, {T}: Add one mana of any color.",common,,,Land
249,"Elspeth, Undaunted Hero",W,5.0,{2}{W}{W}{W},,,5.0,"[+2]: Put a +1/+1 counter on each of up to two target creatures.
[−2]: Search your library and/or graveyard for a card named Sunlit Hoplite and put it onto the battlefield. If you search your library this way, shuffle.
[−8]: Until end of turn, creatures you control gain flying and get +X/+X, where X is your devotion to white.",mythic,,Legendary,Planeswalker
250,Eidolon of Inspiration,W,3.0,{1}{W}{W},2.0,2.0,,"At the beginning of combat on your turn, target creature you control gets +2/+0 until end of turn.",uncommon,,,"Enchantment, Creature"
251,Elspeth's Devotee,W,4.0,{2}{W}{W},3.0,3.0,,"When Elspeth's Devotee enters the battlefield, you may search your library and/or graveyard for a card named Elspeth, Undaunted Hero, reveal it, and put it into your hand. If you search your library this way, shuffle.",rare,,,Creature
252,Sunlit Hoplite,W,2.0,{1}{W},2.0,1.0,,"As long as it's your turn, Sunlit Hoplite has first strike.
Sunlit Hoplite gets +1/+0 as long as you control an Elspeth planeswalker.",common,,,Creature
253,"Ashiok, Sculptor of Fears","B, U",6.0,{4}{U}{B},,,4.0,"[+2]: Draw a card. Each player mills two cards.
[−5]: Put target creature card from a graveyard onto the battlefield under your control.
[−11]: Gain control of all creatures target opponent controls.",mythic,Mill,Legendary,Planeswalker
254,Swimmer in Nightmares,U,3.0,{2}{U},1.0,4.0,,"Swimmer in Nightmares gets +3/+0 as long as there are ten or more cards in a single graveyard.
Swimmer in Nightmares can't be blocked as long as you control an Ashiok planeswalker.",uncommon,,,Creature
255,Mindwrack Harpy,B,4.0,{3}{B},3.0,2.0,,"Flying
At the beginning of combat on your turn, each player mills three cards.",common,"Flying, Mill",,"Enchantment, Creature"
256,Ashiok's Forerunner,"B, U",5.0,{3}{U}{B},3.0,3.0,,"Flash
When Ashiok's Forerunner enters the battlefield, you may search your library and/or graveyard for a card named Ashiok, Sculptor of Fears, reveal it, and put it into your hand. If you search your library this way, shuffle.",rare,Flash,,Creature
